ride_id,user_id,bike_id,ride_duration,ride_day,satisfaction,issue,comment
R0179,U9104,B78,60,Friday,3,"['reservation problem', 'light']","I faced some issues with my reservation which made the start of the ride frustrating. Additionally, the bike's light wasn't functioning properly, affecting my safety. While the ride itself was enjoyable, these problems definitely detracted from the overall experience. Hoping for improvements next time."
R0180,U5508,B8,90,Wednesday,3,"['unavailable bike', 'saddle']","The bike rental experience was underwhelming due to an unavailable bike and issues with the saddle. It's frustrating when expectations aren't met, especially when planning a ride. I hope improvements can be made for a smoother experience in the future."
R0181,U9441,B182,45,Sunday,5,['none'],"I had a fantastic experience with the bike rental service! Everything was perfect, and the ride was smooth and enjoyable. I’ll definitely be renting again soon!"
R0182,U2370,B278,45,Friday,4,['saddle'],"The ride was enjoyable overall, but I had some discomfort due to the saddle issue. It would be great if the bikes could be checked for wear and tear more regularly. Nonetheless, the service was good, and I appreciated the friendly staff. Looking forward to another ride!"
R0183,U5475,B207,45,Monday,3,"['light', 'saddle']","The ride was decent, but there were a couple of noticeable issues with the bike. The lights were not functioning well, which made it a bit concerning during the ride. Additionally, the saddle was uncomfortable, detracting from the overall experience. Improvements in these areas would be greatly appreciated."
R0184,U7266,B135,90,Tuesday,3,['chain'],"The ride experience was decent, but the chain issue really affected my enjoyment. I expected better performance from the bike. I hope the maintenance on the equipment is improved for future rentals."
R0185,U5460,B126,90,Tuesday,4,['none'],"I had a great time riding! The bike was in good condition, and the experience was enjoyable overall. Just a little room for improvement, but I would definitely rent again."
R0186,U5014,B92,30,Sunday,5,['none'],I had a fantastic experience with the bike rental service! The bike was in excellent condition and made my Sunday ride enjoyable. I can't wait to rent again for my next outing!
R0187,U2495,B43,180,Tuesday,3,['light'],"The ride had some issues with the lights, which affected the overall experience. Although it was a decent duration, the bike's functionality didn't meet expectations. I hope improvements can be made for future rentals."
R0188,U4428,B179,30,Thursday,2,"['reservation problem', 'saddle']","I had a frustrating experience with my bike rental. There were issues with my reservation, and the saddle was uncomfortable. Overall, it didn't meet my expectations, and I hope to see improvements in the future."
R0189,U3148,B170,120,Sunday,1,"['reservation problem', 'battery']","I had a terrible experience with my bike rental. There were issues with my reservation, and the battery died halfway through my ride. This made my Sunday outing very frustrating and disappointing. I cannot recommend this service based on my experience."
R0190,U3713,B3,30,Sunday,2,"['battery', 'saddle']","I was really disappointed with my experience. The battery didn’t hold up, and the saddle was uncomfortable, making the ride frustrating. I expected a much better experience from the service."
R0191,U7152,B125,45,Tuesday,2,"['brakes', 'battery']","I had a disappointing experience with my bike rental. The brakes were not functioning properly and the battery life was inadequate, which made for a frustrating ride. I hope these issues are addressed for future customers."
R0192,U6671,B84,120,Monday,3,['reservation problem'],"I encountered a reservation problem during my ride, which was quite frustrating. It impacted my overall experience, and I felt it could have been handled better. I hope improvements can be made to prevent this from happening in the future."
R0193,U6464,B51,30,Tuesday,1,"['cargo', 'battery']","I was really disappointed with my bike rental experience. The cargo space was insufficient, and the battery died midway through my ride, leaving me stranded. I expected better quality and reliability. Unfortunately, I won't be renting from here again."
R0194,U4255,B211,45,Monday,2,"['battery', 'light']","I was disappointed with my recent rental experience. The battery didn’t hold up well during my ride and the light was not functioning properly. It really affected my enjoyment, and I hope these issues can be addressed for future customers."
R0195,U9636,B158,45,Tuesday,5,['chain'],"I had a fantastic experience with my bike rental! The ride was smooth and enjoyable, despite a minor issue with the chain. Overall, it was a great way to spend my Tuesday. Would definitely rent again!"
R0196,U1788,B190,30,Thursday,5,['none'],The bike rental experience was fantastic! The bike was in great condition and made for a smooth ride. Highly recommend this service for anyone looking to enjoy a pleasant outing.
R0197,U4082,B214,90,Sunday,4,['reservation problem'],"Even though I encountered a reservation problem, I still enjoyed my ride overall. The bike was in great condition and the scenery was beautiful. I hope the booking process can be improved for future rentals. Looking forward to trying again!"
R0198,U2061,B294,120,Thursday,4,['light'],"The ride was enjoyable, and everything went smoothly for the most part. However, the light issue was a bit concerning. Overall, I had a great time and would love to rent again soon."
R0199,U4050,B241,120,Friday,3,['unavailable bike'],"The bike availability was a significant issue during my experience, which affected my overall enjoyment of the ride. I was disappointed that I couldn't get a bike right when I needed it. I hope they improve their inventory management for future renters."
R0200,U9656,B186,45,Tuesday,5,['unavailable bike'],"I had an excellent experience with the bike rental service! The bike was in great condition and made my ride enjoyable. I did face an issue with an unavailable bike initially, but the overall service and quality really stood out. I'll definitely be renting again!"
R0201,U4296,B263,60,Saturday,4,['reservation problem'],"I enjoyed my ride overall, but I faced some challenges with the reservation process. It was a bit frustrating, but once I got on the bike, the experience improved significantly. The bike was in great condition and made for a pleasant ride. I hope the reservation issues get resolved for next time!"
R0202,U9176,B143,30,Friday,4,['unavailable bike'],"While I enjoyed my ride, I was disappointed to find an unavailable bike which disrupted my plans. The overall experience was good, but the bike availability needs to be improved. I hope this is addressed for a smoother experience next time."
R0203,U5455,B295,30,Saturday,2,['reservation problem'],I was really disappointed with my experience due to a reservation problem. It caused unnecessary stress and affected my ride. I expected better organization from the bike rental service. It's unlikely I'll rent again unless this is resolved.
R0204,U7296,B228,30,Sunday,1,"['reservation problem', 'unavailable bike']","I had a frustrating experience with my bike rental. The reservation issue meant I couldn’t get an available bike, which completely ruined my plans for the day. I expected better service, and I’m very disappointed with how everything was handled."
R0205,U5116,B195,180,Wednesday,3,"['brakes', 'light']","I faced some issues with the brakes and the bike's light during my ride, which affected the overall experience. While the bike was usable, these problems made it less enjoyable. I'm hopeful that the rental service can address these concerns for future rides."
R0206,U3392,B271,120,Monday,4,['light'],"The ride was quite enjoyable, with only a minor lighting issue that didn't significantly impact the experience. The bike was well-maintained and comfortable for the duration. Overall, a great way to spend a Monday!"
R0207,U7877,B155,90,Tuesday,3,['light'],"I had a decent experience with the bike rental, but the lighting issue was a concern during my ride. It made navigating a bit tricky and took away from the overall enjoyment. I hope they can address these issues to improve future rides."
R0208,U9721,B216,60,Wednesday,5,['battery'],I had a fantastic experience with the bike rental! The ride was smooth and enjoyable. I appreciate how well-maintained the bikes are. Definitely coming back for another ride soon!
R0209,U3371,B86,60,Sunday,2,['brakes'],"I had a disappointing experience with my bike rental. The brakes were problematic, which made the ride quite worrying. I expected better maintenance for safety. I'm unlikely to rent again unless improvements are made."
R0210,U8007,B289,60,Wednesday,3,"['reservation problem', 'saddle']","Unfortunately, my experience was less than smooth. I faced issues with my reservation and the saddle wasn't comfortable at all. While the ride itself was enjoyable, these problems really took away from the experience. I hope improvements can be made for future rides."
R0211,U3349,B187,60,Friday,2,"['unavailable bike', 'saddle']","I was really disappointed with my experience. The bike I wanted was unavailable, and the saddle was uncomfortable, making for a frustrating ride. I expected better service. I hope improvements are made for future rentals."
R0212,U7451,B234,45,Thursday,3,['battery'],"The ride had its challenges, especially with the battery issue that affected our experience. While the bike was enjoyable to use, the reliability could certainly be improved. I hope the service can address these issues for better rides in the future."
R0213,U8100,B138,30,Tuesday,1,"['reservation problem', 'saddle']","I am very disappointed with my recent bike rental experience. The reservation problem caused significant inconvenience, and the saddle was uncomfortable throughout the ride. This left me frustrated and unwilling to rent again."
R0214,U5043,B260,30,Wednesday,3,['battery'],"The ride was somewhat disappointing due to battery issues that affected the experience. I expected a smoother ride, but the interruptions were frustrating. I hope for better performance next time."
R0215,U7631,B23,240,Friday,4,['light'],"The ride was enjoyable, and the overall experience was quite positive. However, the light issue did impact the ride a bit. Despite that, I appreciated the service and would consider renting again."
R0216,U3449,B35,60,Friday,5,['none'],"I had an amazing experience with the bike rental service! The ride was smooth and enjoyable, with no issues whatsoever. I highly recommend this service for a fun day out on a bike!"
R0217,U1713,B152,240,Wednesday,2,"['chain', 'reservation problem']","Unfortunately, my experience was quite disappointing. The chain on the bike had issues, which made the ride frustrating, and there were also problems with my reservation. I expected a smoother experience overall."
R0218,U1867,B219,30,Tuesday,3,['light'],"The ride was fairly decent, but the light issues definitely impacted the experience. It would be great to have better lighting on the bike for improved safety and enjoyment. Overall, there’s room for improvement to enhance future rentals."
R0219,U5022,B242,60,Friday,2,"['light', 'unavailable bike']","Very disappointed with my experience. The bike I wanted was unavailable, and the lights were not functioning properly. It really affected my ride and made it less enjoyable. I hope these issues can be resolved for future customers."
R0220,U9122,B132,30,Tuesday,3,"['light', 'saddle']","I encountered a couple of issues during my ride, specifically with the bike's light and saddle. While the ride itself was decent, these problems detracted from the overall experience. I hope future rentals have these matters resolved for a better experience."
R0221,U2148,B195,45,Sunday,4,['cargo'],"The ride was enjoyable and the bike was in good condition. However, there were some issues with the cargo that could use improvement. Overall, it was a solid experience, but there's room for enhancement."
R0222,U5101,B166,30,Tuesday,5,['none'],"I had an amazing experience with the bike rental service! The bike was in great condition, and everything went smoothly during my ride. I thoroughly enjoyed the freedom of exploring without any issues. Highly recommend!"
R0223,U7335,B288,30,Monday,4,['chain'],"The ride was enjoyable overall, but I did experience some issues with the chain during my trip. It interrupted the flow a bit, which was disappointing. However, the bike was otherwise in good condition and met my needs for the day. I hope the chain issue gets addressed for future rentals."
R0224,U2821,B196,180,Thursday,4,['brakes'],"The ride was enjoyable overall, but I did experience some issues with the brakes that made me a bit uneasy at times. Despite that, the scenery was beautiful and the bike was generally in good shape. I appreciate the service and hope the brake situation can be addressed for future rentals."
R0225,U7493,B125,45,Thursday,4,['saddle'],"The ride was enjoyable and the bike performed well overall. However, I did experience an issue with the saddle that was a bit uncomfortable. Despite that, I still had a good time exploring and would consider renting again."
R0226,U3753,B290,60,Thursday,2,"['unavailable bike', 'battery']","I was really disappointed with my experience. The bike I wanted was unavailable, and the battery issues made for a frustrating ride. I expected better service and reliability. Unfortunately, this was not the experience I had hoped for."
R0227,U8277,B33,60,Wednesday,5,['battery'],"I had a fantastic experience with the bike rental service! Despite the minor battery issue, the ride was smooth and enjoyable. The bike was comfortable, and I was able to explore the area without any major concerns. Highly recommend for a great day out on the trails!"
R0228,U6212,B295,45,Sunday,5,['reservation problem'],"I had a fantastic experience with the bike rental service! Despite a small reservation hiccup, everything else went smoothly, and I enjoyed a wonderful 45-minute ride on a beautiful Sunday. I appreciate the quick resolution and am looking forward to renting again!"
R0229,U5921,B47,60,Thursday,5,['light'],"I had an amazing ride on Thursday! The bike was in great condition, and the overall experience was smooth and enjoyable. I'll definitely be renting again!"
R0230,U2590,B87,30,Thursday,2,"['light', 'reservation problem']","I had a frustrating experience with my bike rental. The light on the bike was not functioning properly, and I faced issues with my reservation that made my ride inconvenient. I expected better service and hope improvements are made in the future."
R0231,U5168,B246,300,Wednesday,4,['light'],"I had a great experience with the bike rental service on Wednesday, and the ride duration was perfect for my needs. The bike performed well, but I did notice the lights could use some improvement for better visibility. Overall, I enjoyed my ride and appreciated the service."
R0232,U8708,B220,120,Monday,3,"['light', 'chain']","Unfortunately, my ride was hindered by some issues with the bike's lights and chain. While the scenery was enjoyable, these mechanical problems significantly affected my overall experience. I hope to see improvements in the bike maintenance for future rentals."
R0233,U1175,B291,90,Thursday,5,['light'],"The bike rental experience was fantastic! The ride was smooth and enjoyable, with no issues at all. I really appreciated the quality of the service and would highly recommend it to others. Looking forward to my next ride!"
R0234,U7825,B225,60,Tuesday,4,['battery'],"I had a great time with the bike rental overall, and the ride was enjoyable. However, I did encounter a battery issue that impacted my experience a bit. It's unfortunate, but I still appreciate the service provided. Looking forward to a smoother ride next time!"
R0235,U5434,B191,30,Friday,3,"['brakes', 'reservation problem']","The ride had a couple of issues that impacted the experience. The brakes weren't functioning properly, and there was a problem with my reservation. I expected better service and hope these issues can be addressed in the future."
R0236,U7474,B104,180,Monday,4,['saddle'],"The ride was quite enjoyable overall, but I did have some discomfort with the saddle. While the bike performed well, the saddle issue slightly affected my experience. Thank you for providing a solid service, but addressing the saddle quality could enhance future rides."
R0237,U6969,B2,45,Sunday,3,"['battery', 'reservation problem']","I encountered some frustrating issues during my ride, particularly with the bike's battery and a reservation mix-up. This really impacted my experience and left me feeling disappointed. I hope these problems can be addressed for future riders."
R0238,U4888,B38,30,Thursday,4,['chain'],"The ride was enjoyable and the scenery was beautiful, making the 30 minutes feel like a breeze. However, I did experience a minor issue with the bike chain that affected my overall experience. Despite that, I would still consider renting again."
R0239,U3777,B90,45,Saturday,3,['chain'],"The ride had some frustrating moments due to chain issues that affected our experience. While the bike was generally decent, dealing with the problem took away from the enjoyment of the ride. I hope the service can address these maintenance concerns for future rentals."
R0240,U6645,B13,90,Thursday,4,['saddle'],"The ride was enjoyable overall, but I did have some discomfort with the saddle. It would be great if the service could offer more comfortable options. Looking forward to my next ride!"
R0241,U2261,B152,60,Monday,2,"['brakes', 'light']","I had a disappointing experience with the bike rental. The brakes were not functioning well, and the light was inadequate, making my ride unsafe. I expected better maintenance and will think twice before renting again."
R0242,U6256,B233,90,Saturday,1,"['unavailable bike', 'reservation problem']","I was really disappointed with my experience. The bike I reserved was unavailable, and the whole process felt disorganized. It ultimately left me frustrated, and I couldn't enjoy my ride at all. I hope they improve their reservation system in the future."
R0243,U1852,B289,90,Friday,3,"['light', 'battery']","The ride had some frustrating issues with the light and battery, which impacted my overall experience. I expected better performance for my trip, especially on a busy Friday. I hope improvements can be made for future rentals."
R0244,U6847,B147,30,Friday,2,"['light', 'battery']","I was really disappointed with my bike rental experience. The lights were not functioning properly, and I encountered battery issues that made the ride frustrating. Unfortunately, this affected my overall enjoyment of the service. I hope improvements can be made."
R0245,U6658,B262,180,Wednesday,1,"['unavailable bike', 'cargo']","I had a very disappointing experience with this bike rental service. The bike I reserved was unavailable, and dealing with the cargo situation made things even more frustrating. I expected better reliability and support. Unfortunately, I won't be using this service again."
R0246,U1759,B295,45,Friday,5,['brakes'],"The ride went smoothly and the bike performed exceptionally well throughout. I particularly appreciated the reliability of the brakes, which gave me confidence during my journey. It was a great experience overall, making it easy to enjoy the ride!"
R0247,U7816,B258,60,Saturday,4,['light'],"The bike ride was enjoyable overall, with only minor issues related to the light functioning. The bike was comfortable and perfect for a leisurely Saturday. Despite the small hiccup, I had a great time exploring. Would definitely rent again!"
R0248,U4741,B140,30,Friday,4,['saddle'],"I had a great ride overall, but I did experience some discomfort with the saddle. It's a bummer because everything else was smooth and enjoyable. Hopefully, the saddle issue can be addressed for an even better experience next time!"
R0249,U8081,B98,300,Wednesday,2,['chain'],"I was really disappointed with my bike rental experience. The chain kept slipping throughout the ride, which made it frustrating and unsafe. I expected better maintenance from your service."
R0250,U1374,B293,45,Friday,3,"['saddle', 'brakes']","The ride was a bit frustrating due to issues with the saddle and brakes. It detracted from the overall experience, and I expected better maintenance. I hope these concerns can be addressed for future rentals."
R0251,U2614,B73,30,Friday,4,['light'],"The ride was enjoyable overall, and I appreciate the prompt service. However, the bike's light was a bit dim, which made it less safe during the ride. Looking forward to improvements on the equipment!"
R0252,U5445,B124,60,Sunday,4,['chain'],"The bike ride was generally enjoyable, and I appreciated the smooth scenery. However, there was an issue with the chain that interrupted the experience. While it wasn't a major setback, it did detract a bit from the overall enjoyment of the ride."
R0253,U2693,B23,30,Wednesday,4,['none'],"I had a great experience renting a bike this Wednesday. The ride was smooth and enjoyable, making the 30 minutes feel like a breeze. I appreciated the well-maintained bike and friendly service. Looking forward to my next ride!"
R0254,U3968,B238,30,Wednesday,4,['unavailable bike'],"I had a good experience overall, but the lack of available bikes was quite frustrating. It impacted my plans for the day. I hope this issue can be addressed for better convenience in the future."
R0255,U6944,B195,60,Saturday,3,"['unavailable bike', 'reservation problem']",I encountered some issues with my reservation and there wasn't a bike available when I arrived. This was frustrating and disrupted my plans for the day. I hope the service can improve the booking process to enhance the customer experience.
R0256,U2300,B26,45,Thursday,4,['unavailable bike'],"I had a good experience overall, but I was disappointed that the bike I wanted was unavailable. The ride itself was enjoyable and the renting process was smooth. It would be great if they could ensure more bikes are available during peak times."
R0257,U7098,B67,180,Friday,2,"['chain', 'saddle']","I was really disappointed with my rental experience. The chain kept slipping during my ride, and the saddle was uncomfortable, making it hard to enjoy the time spent biking. Unfortunately, I expected a smoother ride and better equipment. "
R0258,U1930,B167,45,Thursday,5,['brakes'],Great experience overall! The bike was smooth to ride and I had no issues with the brakes during my 45-minute ride. I really enjoyed my Thursday outing and would definitely rent again!
R0259,U2576,B162,90,Tuesday,3,"['battery', 'unavailable bike']","My experience was quite frustrating due to a couple of issues. The bike I reserved was not available, and the battery life was disappointing. I expected a smoother ride, but these problems really affected my overall experience. I hope improvements are made for future rentals."
R0260,U6288,B240,60,Friday,5,['none'],"I had a fantastic experience renting a bike! Everything went smoothly, and I thoroughly enjoyed my ride. The bike was in great condition, making my Friday outing even better. I highly recommend this service for anyone looking to explore on two wheels!"
R0261,U8140,B80,90,Monday,5,['chain'],"I had a fantastic ride on Monday! The bike was smooth and enjoyable, and I loved every minute of it. I encountered a minor issue with the chain, but it didn't detract from my overall experience. I can't wait to rent again!"
R0262,U2535,B277,60,Tuesday,4,['brakes'],"I had a great ride overall, but I encountered issues with the brakes that made me a bit uneasy. The rental bike was generally in good condition, and I appreciated the helpful staff. I hope the brake issue can be resolved for future rides."
R0263,U3699,B133,60,Friday,5,['saddle'],"The ride was fantastic overall, and I really enjoyed the experience. However, I did encounter an issue with the saddle, which was uncomfortable at times. Despite that, the service and bike quality were great. Looking forward to my next ride!"
R0264,U9325,B246,240,Friday,3,"['reservation problem', 'cargo']","I encountered some issues with my reservation that made the experience less enjoyable, and there were problems with the cargo as well. It was frustrating to deal with these complications during my ride. Overall, I expected a smoother process and hope for improvements in the future."
R0265,U9906,B72,45,Saturday,3,"['battery', 'light']","I faced some issues with the battery and the light during my ride, which definitely affected the experience. It was frustrating trying to deal with these problems. I hope the bike maintenance can improve for future rentals."
R0266,U6228,B12,30,Tuesday,3,['brakes'],"The ride had some issues with the brakes, which made me feel a bit unsafe during my trip. While the bike was functional, the braking problem really impacted my overall experience. I hope the maintenance team can address this for future rentals."
R0267,U5022,B17,90,Monday,2,"['reservation problem', 'saddle']","I was very disappointed with my experience. The reservation problem caused a lot of hassle, and the saddle was uncomfortable which made the ride difficult. Overall, I expected much better service and quality."
R0268,U4121,B112,120,Sunday,1,"['saddle', 'unavailable bike']","I had a terrible experience with my bike rental. The saddle was uncomfortable, and I couldn't get the bike I wanted, leading to a frustrating ride. I'd recommend looking elsewhere if you're after a smooth experience."
