ride_id,user_id,bike_id,ride_duration,ride_day,satisfaction,issue,comment
R0090,U8489,B43,60,Wednesday,4,['unavailable bike'],"Despite the inconvenience of an unavailable bike at first, I appreciated the quick resolution and was able to enjoy a nice ride once I got one. The overall experience was pleasant, and I felt supported by the staff. Looking forward to renting again!"
R0091,U4916,B151,30,Monday,3,['unavailable bike'],"I was disappointed that the bike I wanted was unavailable, which affected my overall experience. While the ride itself was fine, the situation could have been handled better. I hope for more availability in the future."
R0092,U8242,B135,90,Saturday,3,"['unavailable bike', 'saddle']","The ride had a few hiccups, including an unavailable bike and issues with the saddle, which affected the overall experience. It was disappointing to encounter these problems on what should have been an enjoyable Saturday ride. Improvements are definitely needed to enhance the service."
R0093,U8574,B253,60,Thursday,3,['unavailable bike'],"I encountered some issues with the bike availability which affected my overall experience. It was frustrating to not have a bike ready when I arrived. While the ride itself was enjoyable, the initial hiccup really put a damper on the experience. I hope this can be improved in the future."
R0094,U4486,B118,45,Thursday,1,"['reservation problem', 'unavailable bike']","I'm really disappointed with my experience. There was a reservation problem, and the bike I had booked was unavailable when I arrived. This made the whole rental process frustrating and inconvenient. I expected better service."
R0095,U9081,B99,30,Sunday,2,"['reservation problem', 'unavailable bike']","I was disappointed with my experience. There was a reservation problem that led to an unavailable bike, which disrupted my plans for the day. I expected a smoother process and better availability. Unfortunately, this impacted my overall enjoyment."
R0096,U3594,B24,120,Friday,4,['chain'],"The ride was generally enjoyable, but I did experience some issues with the bike chain. It made things a bit inconvenient during the trip. However, I appreciated the overall experience and the beautiful scenery. Would rent again!"
R0097,U3155,B250,45,Wednesday,3,"['light', 'cargo']","The ride had some challenges with the lighting and cargo setup, which took away from the overall experience. While the bike was still usable, these issues made it less enjoyable than expected. I hope these problems can be addressed for a smoother ride in the future."
R0098,U7141,B226,90,Wednesday,2,"['saddle', 'reservation problem']","I was disappointed with my experience today. The saddle was uncomfortable, which made the ride less enjoyable, and there was also a problem with my reservation that added to my frustration. I hope these issues can be addressed for future customers."
R0099,U6730,B13,30,Wednesday,3,"['brakes', 'battery']","The ride had some significant issues, particularly with the brakes and battery, which really impacted my experience. It was frustrating to deal with these problems during my trip. I hope the service can improve the condition of their bikes moving forward."
R0100,U2257,B130,240,Monday,2,['reservation problem'],"I was really disappointed with my experience. The reservation problem created a lot of unnecessary hassle and made the whole ride frustrating. I expected a smoother process when renting a bike, but this left a bad impression. I hope improvements can be made for future customers."
R0101,U8493,B144,30,Friday,1,['unavailable bike'],"I had a very disappointing experience with the bike rental service. When I arrived, the bike I had reserved was unavailable, which ruined my plans. I expected better management and communication. I won't be using this service again."
R0102,U2798,B141,30,Saturday,4,['none'],"I had a great time riding this Saturday! The bike was in good condition, making for a smooth 30-minute ride. Everything went well, and I would definitely recommend this service to others!"
R0103,U8243,B275,120,Tuesday,1,"['unavailable bike', 'reservation problem']","My experience was quite disappointing. The bike I reserved was unavailable, causing a reservation problem that ruined my plans. This level of service is unacceptable, and I hope improvements are made in the future."
R0104,U1066,B46,180,Wednesday,2,"['unavailable bike', 'brakes']","I was really disappointed with my experience. There was no bike available when I arrived, and the one I eventually got had problems with the brakes. I expected a smoother process and better maintenance. This was not the ride I hoped for."
R0105,U8170,B92,30,Saturday,2,"['saddle', 'unavailable bike']","I was quite disappointed with my experience. The bike was unavailable, which caused a lot of frustration, and the saddle was uncomfortable. It really impacted my ride, and I expected better service."
R0106,U8081,B55,60,Monday,3,['unavailable bike'],"I was disappointed that the bike I wanted was unavailable when I arrived, which affected my rental experience. The ride duration was fine, but the initial inconvenience really took away from the enjoyment. I hope the availability of bikes can improve in the future."
R0107,U8022,B73,90,Thursday,2,"['brakes', 'reservation problem']","I was pretty disappointed with my recent experience. The brakes were problematic, which made the ride feel unsafe, and there was also confusion with my reservation. I expected better service and quality from the rental."
R0108,U6982,B272,120,Thursday,2,"['light', 'unavailable bike']","I had a frustrating experience during my ride. The bike I reserved was unavailable, and the lighting was inadequate, making it difficult to enjoy my time. I expected better service and reliability from this rental service. Overall, it was disappointing."
R0109,U5243,B282,45,Friday,4,['reservation problem'],"I had a great experience overall, but there was a hiccup with my reservation that caused some confusion. Thankfully, the staff was helpful in resolving it quickly. The ride was enjoyable, and I appreciated the bike's condition. Looking forward to renting again!"
R0110,U7345,B14,60,Tuesday,3,"['reservation problem', 'light']","I encountered a reservation problem that made the start of my ride a bit frustrating. Additionally, the bike’s light was not functioning properly, which was concerning. While I enjoyed the ride overall, these issues detracted from the experience. I hope they can be addressed for future rentals."
R0111,U3493,B189,90,Friday,3,['saddle'],"The ride started off well, but I experienced some discomfort with the saddle. It affected my overall enjoyment during the 90 minutes. I hope the issue can be addressed for future rentals."
R0112,U8025,B70,90,Wednesday,3,['saddle'],"The ride was enjoyable, but the saddle was uncomfortable, which affected my overall experience. I had hoped for a smoother ride, especially over 90 minutes. Improvements in equipment could really enhance the rental service."
R0113,U6000,B58,90,Friday,2,"['light', 'brakes']","The bike I rented had significant issues with the brakes, making it quite unsafe during my ride. Additionally, the lights were not functioning properly, which added to my concerns. Overall, this experience was disappointing and I expected better maintenance for the bikes. I hope improvements can be made for future customers."
R0114,U5129,B88,60,Monday,2,['chain'],"I was really disappointed with my experience. The bike had a chain issue that made my ride frustrating and less enjoyable. I expected better maintenance for the bikes. Unfortunately, I won't be renting here again."
R0115,U5549,B59,30,Thursday,3,['light'],"The ride was decent, but the lights were a bit of an issue. It would have been better if everything was functioning properly. Overall, a fair experience, but there's room for improvement."
R0116,U6118,B147,180,Thursday,2,"['saddle', 'light']","I was really disappointed with my ride. The saddle was uncomfortable, and the light didn't work properly, making it difficult to see. I was hoping for a better experience with the bike rental service."
R0117,U1335,B298,120,Tuesday,3,"['brakes', 'light']","I encountered some issues during my ride, particularly with the brakes and the light. This affected my overall experience and made me feel somewhat uneasy while biking. I hope these concerns can be addressed for future rentals."
R0118,U2258,B176,90,Monday,4,['saddle'],"I had a great ride overall, but I did experience some discomfort due to the saddle. The bike itself was in good condition, and I enjoyed the route. I hope the saddle issue can be addressed for even better future rides!"
R0119,U3209,B217,30,Tuesday,4,['none'],I had a great experience with the bike rental service! The bike was in excellent condition and perfect for my 30-minute ride. I appreciated the ease of the entire process. Looking forward to my next ride!
R0120,U2030,B148,30,Wednesday,2,"['brakes', 'unavailable bike']","I was disappointed with my experience. The brakes on the bike were not functioning properly, and when I arrived, the bike I wanted was unavailable. This made my ride less enjoyable and frustrating. I hope these issues can be addressed for future rentals."
R0121,U4956,B5,90,Monday,5,['battery'],"I had a fantastic experience with the bike rental service! The ride was smooth and enjoyable for the entire 90 minutes. The overall condition of the bike was excellent, making it a pleasure to ride. I'd definitely recommend this service to others!"
R0122,U7014,B26,30,Sunday,2,['chain'],"I was really disappointed with my experience. The bike chain issue made the ride frustrating and uncomfortable. I expected a smoother journey, especially for a Sunday outing. Not what I had hoped for."
R0123,U6889,B81,240,Wednesday,5,['reservation problem'],"I had a fantastic experience overall! The bike was in great condition and the ride was smooth. However, I did encounter a reservation issue that was a bit frustrating. Despite that, I still enjoyed my time and would recommend the service."
R0124,U5239,B73,45,Saturday,1,"['unavailable bike', 'light']","I had a disappointing experience with the bike rental service. The bike I wanted was unavailable, and the lighting was inadequate for my ride. Overall, it didn't meet my expectations, and I won't be returning anytime soon."
R0125,U8694,B252,90,Sunday,4,['unavailable bike'],"I had a good ride overall, but it was frustrating to find the bike I wanted was unavailable. The rental process was smooth, and the ride itself was enjoyable. I hope they can improve bike availability for future trips!"
R0126,U6086,B253,120,Monday,2,"['brakes', 'unavailable bike']","My experience was disappointing due to multiple issues, including faulty brakes and the unavailability of the bike I wanted. These problems significantly impacted my ride and overall enjoyment. I expected better service and hope improvements are made."
R0127,U1712,B256,45,Friday,4,['none'],I had a great experience renting a bike on Friday! The ride was smooth and enjoyable throughout the 45 minutes. Looking forward to using this service again for my next adventure!
R0128,U7884,B191,45,Saturday,3,"['battery', 'chain']","The ride experience was disappointing due to issues with the battery and chain, which affected the enjoyment of the journey. It's frustrating when equipment doesn't perform as expected. I hope these maintenance concerns are addressed for future riders."
R0129,U6170,B167,60,Friday,5,['none'],"I had an amazing experience with the bike rental service! The bike was in excellent condition, and the ride was smooth throughout. I couldn't have asked for a better way to spend my Friday. Highly recommended!"
R0130,U6711,B195,60,Wednesday,3,"['reservation problem', 'unavailable bike']","I encountered some frustrating issues with my reservation not going through and the bike I wanted was unavailable. This really impacted my experience, making it less enjoyable than I had hoped. I appreciate the service, but improvements are definitely needed to avoid these issues in the future."
R0131,U6087,B122,45,Wednesday,2,"['saddle', 'light']","I was really disappointed with my experience. The saddle was uncomfortable, and the light didn’t work properly, which made the ride less enjoyable and safe. I expected better quality from the bike rental service."
R0132,U5981,B201,60,Monday,3,['brakes'],"The ride had its challenges, particularly with the brakes that raised some safety concerns. While the duration was enjoyable, the brake issue definitely impacted my overall experience. I hope this gets addressed for future rides."
R0133,U1815,B238,180,Thursday,5,['light'],"Had an amazing ride on Thursday! The bike was in excellent condition, and the weather was perfect. Truly enjoyed every moment; can't wait to rent again!"
R0134,U6032,B229,60,Sunday,2,"['chain', 'light']","I was disappointed with my experience. The bike had issues with the chain and the light, which made the ride unpleasant. I expected better maintenance for a rental service. I hope improvements can be made for future customers."
R0135,U8153,B184,30,Sunday,1,"['reservation problem', 'saddle']","I had a frustrating experience with my bike rental. There was a reservation problem, and the saddle was uncomfortable, making the ride very unpleasant. I expected much better service, and I left disappointed."
R0136,U3735,B18,45,Monday,3,"['light', 'cargo']",The ride had some issues with the lights and cargo that made it less enjoyable. It was frustrating to deal with these problems during my trip. I hope these can be sorted out for future rentals.
R0137,U6424,B217,45,Friday,2,"['saddle', 'reservation problem']","I had a frustrating experience with the bike rental. The saddle was uncomfortable, and there were issues with my reservation that added to the disappointment. I expected a smoother experience, especially for a Friday ride. I hope these problems are addressed for future customers."
R0138,U1277,B110,30,Wednesday,5,['chain'],"The bike was in fantastic shape and made for an enjoyable ride. Even though there were chain issues reported, it didn't affect my overall experience. I would definitely rent again!"
R0139,U4127,B223,30,Sunday,5,['none'],"I had an excellent experience renting a bike! The ride was smooth, and everything was in perfect condition. It made for a fantastic Sunday outing. I can't wait to rent again!"
R0140,U4930,B162,90,Monday,3,['reservation problem'],"I encountered some issues with my reservation that affected my overall experience. While the bike ride was enjoyable, the hassle in securing the rental detracted from the fun. I hope these reservation problems can be improved in the future."
R0141,U9843,B264,45,Sunday,1,['unavailable bike'],"I was really disappointed with my experience. The bike I wanted was unavailable, which ruined my plans for the day. I expected better service, especially on a weekend when many people are looking to rent bikes."
R0142,U2931,B102,240,Saturday,4,['brakes'],"The bike rental experience was mostly good, but I did encounter issues with the brakes during my ride. It was a bit concerning, especially on a busy Saturday. Overall, I enjoyed the ride, but the equipment could use some attention for future rentals."
R0143,U3488,B279,30,Monday,5,['reservation problem'],"I had an excellent experience with my bike rental! Despite a minor reservation issue, everything else went smoothly, and the bike was in great condition. I appreciate the quick resolution and will definitely rent again!"
R0144,U4676,B253,30,Monday,2,['saddle'],"I had a disappointing experience with the bike rental. The saddle was uncomfortable, which really impacted my ride. I expected better quality and maintenance for the bikes. I hope these issues can be addressed for future rentals."
R0145,U9932,B100,90,Saturday,3,"['brakes', 'reservation problem']","I encountered some frustrating issues with my bike during the ride, particularly with the brakes malfunctioning. Additionally, there were problems with my reservation that added to the disappointment. Overall, the experience didn't meet my expectations, and improvements are definitely needed."
R0146,U8679,B145,120,Tuesday,3,['battery'],"I encountered some issues with the bike's battery during my ride, which impacted my overall experience. While the ride was enjoyable, the battery problem was quite frustrating. I hope improvements can be made so future rentals can be smoother."
R0147,U1312,B159,45,Thursday,1,['light'],"I had a disappointing experience with the bike rental service. The light issue made the ride uncomfortable and unsafe, significantly affecting my enjoyment. I expected a better quality of bike and maintenance. Unfortunately, I won't be renting from here again."
R0148,U3105,B230,30,Sunday,1,"['reservation problem', 'battery']","I had a very disappointing experience with the bike rental service. There were significant issues with my reservation, and the battery was low, making my ride frustrating. Overall, this was not the experience I expected, and I hope improvements are made for future customers. "
R0149,U8394,B207,30,Thursday,4,['light'],"The bike ride was enjoyable overall, with only minor issues regarding the light. It was a pleasant way to spend my Thursday, and I appreciated the ease of the rental process. Looking forward to riding again!"
R0150,U1524,B255,60,Wednesday,2,['light'],"Unfortunately, my experience with the bike rental was not satisfactory. I encountered issues with the light during my ride, which made it difficult to feel safe. I expected a better quality of service, especially for my Wednesday ride. I hope improvements can be made."
R0151,U8700,B111,60,Wednesday,1,"['reservation problem', 'saddle']","I had a really frustrating experience with my bike rental. There was a reservation problem and the saddle was uncomfortable, making my ride very unpleasant. I expected much better service and equipment. This won’t be my first choice for bike rentals in the future."
R0152,U3532,B151,45,Monday,5,['reservation problem'],"Despite a minor reservation issue, the overall experience was fantastic. The bike was in great condition and the ride was enjoyable. I'll definitely rent again!"
R0153,U9257,B129,30,Sunday,4,['saddle'],"The ride was enjoyable, but I did experience some discomfort with the saddle. Overall, the service was good and I appreciated the bike performance. Addressing the saddle issue would make the experience even better for future rides."
R0154,U3642,B272,60,Wednesday,3,"['brakes', 'light']","I had a decent experience with the bike rental, but there were some notable issues. The brakes were not very responsive and the light was not functioning properly, which made my ride less enjoyable. I hope these concerns can be addressed for future rentals."
R0155,U4908,B92,240,Tuesday,3,"['saddle', 'brakes']",The ride experience was somewhat disappointing due to issues with the saddle and brakes. These problems affected the overall enjoyment of the ride. I hope for better maintenance and quality in future rentals.
R0156,U6956,B176,90,Tuesday,3,"['reservation problem', 'unavailable bike']","I encountered issues with my reservation, and the bike I wanted was unavailable, which was quite frustrating. The ride itself lasted 90 minutes but could have been much better with a more seamless experience. I hope improvements can be made in the reservation system."
R0157,U2136,B36,60,Sunday,2,"['unavailable bike', 'reservation problem']","I was really disappointed with my experience. The bike I reserved was unavailable, and the reservation process was frustrating. It ruined my plans for the day. I hope improvements are made for future customers."
R0158,U6012,B255,30,Monday,2,"['reservation problem', 'saddle']","My experience with the bike rental was disappointing. I faced issues with my reservation and the saddle was uncomfortable. I expected better service and bike quality. Overall, it didn't meet my expectations."
R0159,U5544,B115,45,Saturday,2,"['brakes', 'chain']","I was quite disappointed with my experience. The brakes were not functioning properly, and the chain kept slipping during my ride, which made it frustrating. I expected better maintenance, especially on a busy Saturday. I hope these issues are addressed for future rentals."
R0160,U8054,B102,45,Friday,3,['unavailable bike'],The experience was frustrating due to the unavailability of the bike I wanted. It made the ride less enjoyable than expected. I hope improvements can be made for future rentals.
R0161,U9963,B175,90,Saturday,3,"['brakes', 'reservation problem']","I had a decent ride, but it was marred by some annoying issues. The brakes were not functioning properly, which made me feel unsafe at times, and there were problems with my reservation that added to the frustration. I hope these issues can be addressed for a better experience next time."
R0162,U6978,B150,120,Sunday,3,['unavailable bike'],"I was disappointed with my experience as the bike I reserved was unavailable. It really put a damper on my Sunday ride plans. While the ride itself was enjoyable once I found another bike, the inconvenience should be addressed for a smoother experience in the future."
R0163,U4682,B254,180,Saturday,2,['unavailable bike'],"I was really disappointed with my experience. The bike I reserved was unavailable, which caused a lot of frustration and wasted time. I expected better service, especially on a busy Saturday. Would not recommend based on this experience."
R0164,U4657,B159,300,Sunday,4,['none'],"I had a great experience with the bike rental service on Sunday. The bike was comfortable and smooth to ride for the full duration. Overall, it made for a fun day out without any issues. Would definitely recommend!"
R0165,U4761,B155,300,Monday,3,['chain'],"The bike ride started off well, but I encountered issues with the chain during my trip, which really impacted my experience. I expected a smoother ride for the duration I was out. I hope the maintenance team can address these issues for future rentals."
R0166,U8325,B32,240,Friday,3,['brakes'],"The ride had some issues with the brakes, which made me feel a bit unsafe at times. While the scenery was great and the journey was enjoyable, the mechanical concerns took away from the overall experience. I hope the service can improve the maintenance for future rides."
R0167,U3890,B7,30,Thursday,2,"['brakes', 'chain']","I had a disappointing experience with the bike rental. The brakes were not functioning properly, and the chain kept slipping, which made it unsafe and frustrating to ride. I hope these issues are addressed for future customers."
R0168,U2502,B120,30,Thursday,3,"['brakes', 'saddle']","The ride had some noticeable issues, particularly with the brakes and saddle, which affected the overall experience. It was disappointing because these problems made it less enjoyable. I hope these can be addressed for future rentals to ensure a better experience."
R0169,U4008,B299,45,Saturday,1,"['reservation problem', 'light']","I had a frustrating experience with my bike rental. There was a significant reservation problem, and the bike's light was not functioning properly. This really affected my ride, and I was disappointed with the service overall. I hope improvements are made for future customers."
R0170,U1204,B275,60,Sunday,3,['reservation problem'],"My experience was hampered by a reservation problem that disrupted my plans. While the ride itself was enjoyable, the booking process needs improvement. I hope the service can enhance its efficiency for a smoother experience in the future."
R0171,U1955,B189,30,Friday,5,['none'],"I had an amazing experience with the bike rental service! The bike was in great condition, and I enjoyed every minute of my ride. I’ll definitely be back for more adventures!"
R0172,U1810,B189,120,Thursday,2,"['reservation problem', 'chain']","I had a frustrating experience with the bike rental. There was a reservation issue that caused delays, and the chain kept slipping during my ride. Overall, this did not meet my expectations, and I would not recommend it."
R0173,U7943,B118,60,Thursday,4,['light'],"The ride was enjoyable overall, with just a minor issue related to the bike's light. It didn't detract much from the experience, and the service was efficient. Looking forward to my next rental!"
R0174,U7500,B54,60,Wednesday,2,"['brakes', 'battery']","I had a frustrating experience with the bike rental. The brakes were not functioning properly, and the battery life was disappointing. This made my ride unsafe and unenjoyable. I hope improvements are made for future riders."
R0175,U7270,B3,30,Wednesday,4,['none'],I had a great experience with the bike rental service this Wednesday. The bike was in good condition and I enjoyed my ride for 30 minutes without any issues. Would definitely rent again!
R0176,U5156,B102,45,Wednesday,2,"['saddle', 'unavailable bike']","I was really disappointed with my recent bike rental experience. The saddle was uncomfortable, and I faced issues with an unavailable bike which left me frustrated. This ride did not meet my expectations, and I'll be reconsidering my options moving forward."
R0177,U7452,B95,30,Monday,2,['battery'],"The ride was quite disappointing due to battery issues that disrupted the experience. I expected a smoother journey, but the bike's performance let me down. I hope improvements are made in the future for a better experience."
R0178,U2451,B58,120,Monday,3,"['brakes', 'chain']","The ride experience was mixed due to some mechanical issues with the brakes and chain. While the duration was enjoyable, the problems affected overall satisfaction. It's important for the bikes to be in top condition for a better experience. Would appreciate more thorough maintenance in the future."
