ride_id,user_id,bike_id,ride_duration,ride_day,satisfaction,issue,comment
R0357,U2363,B103,30,Sunday,1,"['chain', 'unavailable bike']","I'm extremely disappointed with my experience. The bike I reserved was unavailable, and the chain kept slipping during my ride. This is not what I expected from the service. I hope these issues are addressed promptly in the future."
R0358,U9024,B41,45,Tuesday,1,"['light', 'reservation problem']","I had a disappointing experience with my bike rental. The lights weren't working properly, and there was a mix-up with my reservation. This made my ride frustrating and far from enjoyable. I hope improvements are made for future customers."
R0359,U1818,B31,300,Wednesday,1,"['saddle', 'light']","I had a very frustrating experience renting a bike. The saddle was uncomfortable and the light didn’t work, making my ride quite unpleasant. I expected more reliable equipment. Unfortunately, I won’t be using this service again."
R0360,U7736,B110,30,Wednesday,1,"['battery', 'light']","I had a terrible experience with the bike rental. The battery died halfway through my ride, and the light wasn't working either, making it unsafe. Overall, I am very disappointed with the quality of the bikes and would not recommend this service."
R0361,U8609,B25,30,Tuesday,3,"['saddle', 'unavailable bike']","I encountered some issues during my ride, especially with the saddle, which was uncomfortable. Additionally, it was frustrating that the bike I wanted was unavailable. While the ride itself was okay, these problems definitely impacted my experience. There's room for improvement in the bike selection and maintenance."
R0362,U9016,B21,45,Friday,3,['chain'],"The ride had some issues with the chain, which affected my overall experience. While I appreciated the rental service, the bike's performance could be improved. I hope to see better maintenance in the future."
R0363,U3010,B105,60,Friday,4,['battery'],"The ride was enjoyable and the bike was mostly great, but I did experience some battery issues that affected my experience. I appreciate the service but hope they can address the battery reliability in the future. Overall, it was a nice way to spend my Friday."
R0364,U9040,B61,180,Wednesday,5,['unavailable bike'],"It was a fantastic experience overall! The bike was comfortable and perfect for my long ride on Wednesday. However, I did face an issue with an unavailable bike initially, but once resolved, the ride was enjoyable. I’d definitely rent again!"
R0365,U2043,B166,300,Saturday,4,['unavailable bike'],"I had a great experience overall, but the unavailability of a bike was a frustrating hiccup. Once I got riding, everything else went smoothly. The staff was helpful, and the bike I eventually used was in good condition. I'd definitely rent again, but I hope to see better availability next time."
R0366,U5669,B6,30,Tuesday,3,"['unavailable bike', 'light']","My experience was a bit disappointing due to not having a bike available when I arrived, which wasted some time. Additionally, the bike I ended up with had a malfunctioning light, making my ride less safe. Overall, I expected better reliability and maintenance from the service."
R0367,U5225,B91,30,Monday,2,"['brakes', 'reservation problem']","My experience was quite disappointing. The brakes weren't functioning properly, which made me feel unsafe during my ride. Additionally, there were issues with my reservation that added to the frustration. I expected a better service overall."
R0368,U3843,B136,90,Thursday,1,"['brakes', 'light']","The experience was quite disappointing due to the issues with the brakes and the light. Safety is paramount when renting a bike, and these concerns made the ride uncomfortable and stressful. I expected better maintenance and quality control for the equipment. I won't be returning for a rental anytime soon."
R0369,U1199,B288,45,Sunday,2,"['chain', 'reservation problem']","I was really disappointed with my experience. The chain malfunctioned during my ride, which was frustrating, and I also faced issues with my reservation. I expected better service and reliability from this rental."
R0370,U7947,B190,120,Monday,3,"['chain', 'reservation problem']","I faced some frustrations during my ride on Monday. The chain issue made it difficult to enjoy the trip, and there was a problem with my reservation that added to the hassle. I hope these issues can be addressed for a smoother experience next time."
R0371,U4019,B264,90,Tuesday,5,['none'],"I had an amazing experience renting a bike! The ride was smooth and enjoyable, making my Tuesday all the better. I couldn't have asked for a better outing. Highly recommended!"
R0372,U6954,B103,30,Thursday,2,"['light', 'battery']","I was quite disappointed with my recent bike rental. The lighting was inadequate, and the battery life left much to be desired. Overall, my experience fell short of expectations, and I would not recommend this service based on what I faced."
R0373,U4691,B135,120,Saturday,2,['reservation problem'],"I was really disappointed with my experience this Saturday. There was a reservation problem that made the process frustrating and inconvenient. I expected better organization from the service. Unfortunately, it left me feeling dissatisfied with my ride."
R0374,U4362,B126,30,Monday,3,"['unavailable bike', 'light']","Unfortunately, the bike I needed was unavailable, and the lighting situation on the route was not ideal. This affected my overall experience, making my ride less enjoyable than I had hoped. Improvements in availability and lighting could enhance future experiences significantly."
R0375,U8975,B266,45,Wednesday,4,['brakes'],"The ride was great overall, but I did experience some issues with the brakes. It was a little concerning while riding, but the duration was enjoyable. I'm hoping the brake issue can be addressed for improved safety in the future."
R0376,U1850,B287,60,Friday,4,['cargo'],"I had a great experience overall, but there were some issues with the cargo. It could have been more secure during my ride. Nonetheless, the bike was comfortable and enjoyable to ride. I'd definitely consider renting again!"
R0377,U7628,B288,60,Wednesday,5,['light'],"I had an amazing experience during my bike rental! The ride was smooth, and everything worked perfectly. I really enjoyed the day and would definitely recommend this service to others. Thank you for making it so enjoyable!"
R0378,U7720,B225,90,Tuesday,4,['brakes'],"I had a good overall experience, but I did encounter some issues with the brakes during my ride. Despite that, the bike was comfortable and suited my needs well. With a little improvement in the maintenance, this could be a fantastic service!"
R0379,U4419,B151,90,Tuesday,2,"['reservation problem', 'chain']","I had a disappointing experience with my bike rental. The reservation issue caused a lot of confusion, and the chain problem made the ride even more frustrating. Overall, this was not the enjoyable experience I was hoping for."
R0380,U3361,B162,300,Wednesday,3,['brakes'],"The ride was decent, but I was concerned about the brakes which impacted my overall experience. It's crucial for the equipment to be in good condition for safety. I hope this issue can be addressed for future rentals."
R0381,U1047,B294,300,Thursday,3,['light'],"The ride could have been more enjoyable, as there were some issues with the bike's lights. Although the duration was good, the inconvenience affected the overall experience. I hope the service can address these concerns for a better ride next time."
R0382,U9430,B86,60,Saturday,5,['none'],"I had an amazing experience with the bike rental! The bike was in great condition, and the ride was smooth and enjoyable. Definitely looking forward to renting again soon!"
R0383,U9528,B104,30,Friday,4,['light'],"The ride was enjoyable overall, and I appreciated the smooth experience. The bike was in good condition, though I noticed the light could use some improvement. I had a pleasant time and would consider renting again!"
R0384,U3168,B269,90,Friday,4,['brakes'],"I had a good experience overall, but there was an issue with the brakes that made me a bit nervous during my ride. It's great for a Friday adventure, but I would appreciate it if the maintenance could be improved. Otherwise, it was enjoyable and I look forward to riding again."
R0385,U1287,B116,240,Sunday,2,"['saddle', 'light']","I was really disappointed with my recent rental experience. The saddle was uncomfortable, and the bike light wasn't functioning, making the ride quite challenging. I expected better quality and maintenance. Overall, it didn't meet my expectations at all."
R0386,U2104,B71,45,Wednesday,2,['light'],"The bike had some light issues that really impacted my ride. It felt frustrating, and I expected better quality from the service. I hope the maintenance can improve for future customers. Overall, I was disappointed with my experience."
R0387,U1608,B168,60,Wednesday,3,"['battery', 'cargo']","The ride had some frustrating issues with the battery and cargo, which certainly affected the overall experience. While the bike was functional for the ride, these problems made it less enjoyable. I hope these issues can be addressed for future rentals."
R0388,U8479,B98,45,Sunday,1,"['saddle', 'chain']","I had a frustrating experience with the bike. The saddle was uncomfortable, and the chain kept getting stuck during my ride, which made it difficult to enjoy. I was really disappointed and won’t be renting from here again."
R0389,U9026,B267,30,Tuesday,5,['light'],"I had an excellent experience with the bike rental service! The ride was smooth and enjoyable, with no issues to report. Everything about the bike worked perfectly, making my Tuesday outing a delight. I highly recommend it!"
R0390,U2379,B272,90,Friday,2,"['unavailable bike', 'light']","I was really disappointed with my experience. The bike I wanted was unavailable, and the lighting was poor during my ride. This made for a frustrating and unsafe outing. I hope improvements can be made for future rentals."
R0391,U7719,B92,45,Friday,3,['brakes'],"I was looking forward to my ride, but unfortunately, I experienced issues with the brakes, which affected my overall experience. It's crucial for bike safety, and I hope this gets addressed. While the ride itself was pleasant, the brake problem was concerning."
R0392,U2613,B159,90,Monday,1,['light'],I was really disappointed with my recent bike rental experience. The light issues made it difficult to enjoy the ride safely. I expected better quality equipment for the price I paid. I won't be renting from here again.
R0393,U4304,B295,120,Thursday,5,['none'],"I had an amazing experience with the bike rental service! The ride was smooth and enjoyable, and everything worked perfectly. I couldn't have asked for a better day out on the bike!"
R0394,U6393,B222,120,Tuesday,1,"['unavailable bike', 'brakes']","I'm really disappointed with my experience. The bike I wanted was unavailable, and the brakes on the one I ended up with were not functioning properly. This made for a frustrating ride. Definitely need to improve on availability and bike maintenance."
R0395,U7478,B65,45,Tuesday,1,"['light', 'reservation problem']","I'm very disappointed with my experience. The bike had issues with the lights, which made riding unsafe, and there was a problem with my reservation that caused unnecessary delays. Overall, this ride did not meet my expectations at all. I hope improvements are made for future customers."
R0396,U8870,B177,45,Thursday,4,['light'],"The ride was enjoyable overall, and the bike performed well for the most part. However, there were some issues with the light, which could have been better. Despite this, I had a good experience and would consider renting again."
R0397,U1403,B186,90,Tuesday,3,['battery'],"The ride was serviceable, but I encountered a problem with the battery, which impacted my overall experience. While it got me through the ride, I was left feeling a bit frustrated. I hope future rentals address this issue for a smoother experience."
R0398,U2767,B196,120,Friday,5,['none'],"Had an amazing experience renting a bike! The ride was smooth and enjoyable, making the most out of my Friday. Looking forward to riding again soon!"
R0399,U3524,B8,60,Sunday,3,['reservation problem'],I encountered a reservation problem that made my experience less enjoyable. It was frustrating to deal with issues when I just wanted to enjoy my ride. I hope improvements can be made for smoother bookings in the future.
R0400,U3792,B90,120,Saturday,5,['saddle'],"The ride was fantastic, and I thoroughly enjoyed the experience. The bike performed well, and the scenery was beautiful. However, I did have a small issue with the saddle. Nonetheless, it didn’t ruin my overall enjoyment of the day!"
R0401,U9981,B256,30,Tuesday,3,['brakes'],"I encountered issues with the brakes during my ride, which made me feel a bit uneasy. While the bike was generally okay, the braking problem definitely impacted my overall experience. I hope they can improve the maintenance on their bikes in the future."
R0402,U7995,B73,120,Tuesday,3,['reservation problem'],"I encountered a reservation issue that impacted my experience. While the bike was fine for the ride, the booking process was frustrating. It would be great if the service could improve on this aspect for future customers."
R0403,U3883,B90,30,Tuesday,2,"['unavailable bike', 'saddle']","I was really disappointed with my recent bike rental experience. The bike I reserved was unavailable, and the saddle was uncomfortable. This kind of service is frustrating, especially when I was looking forward to a nice ride. I hope improvements can be made for future customers."
R0404,U9745,B97,30,Monday,1,"['unavailable bike', 'chain']","I had a terrible experience with the bike rental service. Not only was the bike I reserved unavailable, but the chain on the replacement bike also had issues. This disruption made my ride frustrating and unenjoyable. I definitely won’t be renting from them again."
R0405,U5493,B54,60,Sunday,2,"['light', 'saddle']","I was really disappointed with my recent bike rental experience. The saddle was uncomfortable, and the lights weren't functioning properly, making the ride frustrating. I expected better quality for the price I paid. I would not recommend this service without improvements."
R0406,U5506,B47,30,Wednesday,1,"['reservation problem', 'saddle']","I was really disappointed with my experience. There was a reservation problem that caused a lot of confusion, and the saddle was uncomfortable. Overall, I expected much better service and quality. I won't be renting from here again unless issues are addressed."
R0407,U4902,B104,30,Tuesday,3,['light'],"The ride did not meet my expectations due to some issues with the bike's light. It made the experience a bit troublesome, especially since safety is important. I hope future rentals have better-maintained equipment."
R0408,U2294,B262,30,Saturday,2,"['battery', 'reservation problem']","I'm really disappointed with my experience. The bike's battery was problematic, and I also faced issues with my reservation that added to my frustration. Overall, this ride didn't meet my expectations at all. I hope improvements are made for future customers."
R0409,U9408,B1,45,Wednesday,3,"['battery', 'light']",The ride experience was a bit disappointing due to issues with the bike's battery and lights. These problems affected the overall enjoyment and safety of my ride. I hope these can be addressed for future rentals.
R0410,U1125,B85,90,Monday,1,"['unavailable bike', 'battery']","I had a disappointing experience with my bike rental. The bike I wanted was unavailable, and the battery issues made the ride frustrating. I expected better service and reliable equipment. Overall, I won't be renting again after this experience."
R0411,U2568,B19,30,Tuesday,3,['brakes'],"The ride had potential, but the brakes were concerning and impacted my overall experience. I expected better maintenance to ensure safety during my ride. Hopefully, these issues can be addressed for future rentals."
R0412,U3066,B168,90,Friday,5,['unavailable bike'],"I had a fantastic experience with the bike rental service! The ride was smooth and enjoyable, and everything worked perfectly. I appreciate the quality of the bikes and the overall service provided. I can't wait to rent again!"
R0413,U3513,B75,120,Friday,5,['none'],"I had an amazing experience with the bike rental! The ride was smooth and enjoyable, and everything worked perfectly. I couldn't have asked for a better day out on the bike. Highly recommend this service!"
R0414,U2186,B237,30,Tuesday,3,"['saddle', 'reservation problem']","I faced some issues during my ride, particularly with the saddle comfort and a reservation mix-up. This affected my overall experience, making it less enjoyable than I had hoped. I appreciate the service, but improvements in these areas are needed."
R0415,U1161,B175,30,Sunday,1,"['unavailable bike', 'saddle']","I had a really frustrating experience with the bike rental. The bike I had reserved was unavailable, and the saddle was uncomfortable, which made the ride unpleasant. I expected better service and reliability. I won't be renting again unless there are improvements."
R0416,U7098,B235,120,Saturday,2,"['saddle', 'chain']",The ride was disappointing due to issues with the saddle and chain. It really impacted the overall experience and made it less enjoyable. I expected better maintenance for a weekend rental. I hope improvements can be made for future customers.
R0417,U9722,B190,120,Saturday,5,['none'],I had an amazing experience renting a bike this Saturday! The ride was smooth and enjoyable for the full two hours. I couldn't have asked for a better day on two wheels. Highly recommend this service!
R0418,U2096,B132,60,Tuesday,3,['saddle'],The ride felt somewhat uncomfortable due to the saddle issues I experienced. It really affected my overall enjoyment. I hope the equipment can be improved for future rentals.
R0419,U3668,B258,120,Monday,2,"['light', 'battery']","I was really disappointed with my recent bike rental experience. The lights were not functioning properly, and the battery issues made my ride much less enjoyable. I expected better quality for the price I paid. I hope these problems are addressed for future customers."
R0420,U5556,B143,30,Saturday,4,['unavailable bike'],"I had a good experience overall, but I faced an issue with an unavailable bike, which was quite inconvenient. The rental process was smooth aside from that hiccup. I hope they improve their bike availability in the future."
R0421,U9346,B285,45,Wednesday,5,['none'],"I had an amazing experience with the bike rental service! The ride was smooth, and the bike was in fantastic condition. Everything exceeded my expectations, making for a great day out. Highly recommend!"
R0422,U7247,B298,90,Friday,5,['none'],"I had an amazing experience with the bike rental service! The ride was smooth and enjoyable, and everything worked perfectly. I couldn't have asked for a better way to spend my Friday. Highly recommend!"
R0423,U7894,B177,45,Friday,2,"['saddle', 'brakes']","I was really disappointed with my rental experience. The saddle was uncomfortable and the brakes didn't work properly, which made the ride unsafe. I hope the issues are addressed for future customers. Overall, it was not a pleasant experience."
R0424,U6229,B202,90,Monday,2,"['brakes', 'saddle']","I had a disappointing experience with my bike rental. The brakes were not functioning properly and the saddle was uncomfortable, making my ride quite unpleasant. I expected better quality and maintenance. Unfortunately, this ride did not meet my expectations."
R0425,U4752,B77,60,Friday,3,['light'],"The ride was decent, but the issues with the light made it less enjoyable. I expected a smoother experience, especially since it was a Friday evening. Overall, there's plenty of room for improvement."
R0426,U2797,B244,90,Sunday,5,['light'],"I had an amazing experience with the bike rental service! The ride was smooth, and I truly enjoyed the scenery on a lovely Sunday. Everything was in perfect condition, making for a fantastic adventure. Highly recommended!"
R0427,U8777,B201,60,Friday,5,['none'],"I had an amazing experience with the bike rental! The ride was smooth and enjoyable, making my Friday outing perfect. I couldn't have asked for a better way to spend my day. I'll definitely be back for more!"
R0428,U8236,B270,45,Wednesday,2,['unavailable bike'],The experience was quite disappointing due to the unavailability of the bike I had reserved. It significantly affected my plans for the day. I hope the service can improve on their bike availability in the future.
R0429,U1225,B80,30,Saturday,2,"['battery', 'unavailable bike']","I was really disappointed with my experience. The bike I wanted was unavailable, and the battery issue made the ride frustrating. I expected a smoother experience, especially on a Saturday. I hope these problems are fixed for future customers."
R0430,U7437,B236,30,Thursday,2,['chain'],"I was disappointed with my recent bike rental experience. The chain had issues during my ride, which made it quite difficult and uncomfortable. I expected better maintenance from the service. I won't be renting again unless improvements are made."
R0431,U1759,B141,90,Friday,3,['light'],"The ride had its ups and downs, particularly with the light issue that impacted the experience. Although it was enjoyable at times, there were definitely some areas that could use improvement. Overall, it didn't quite meet expectations but had potential for a better experience next time."
R0432,U7650,B56,30,Saturday,4,['none'],I had a great experience renting a bike this Saturday. The ride was smooth and enjoyable with no issues at all. It’s a perfect way to spend the weekend outdoors. I would definitely recommend this service to others!
R0433,U8432,B52,30,Friday,2,"['saddle', 'unavailable bike']","I was disappointed with my bike rental experience. The saddle was uncomfortable and the bike I wanted was unavailable. I expected better service and a more enjoyable ride. Unfortunately, this experience did not meet my expectations."
R0434,U2179,B169,30,Tuesday,2,"['chain', 'unavailable bike']","I had a disappointing experience with the bike rental. The chain kept slipping, and I was unable to get a different bike when I needed one. Overall, I expected much better service and reliability."
R0435,U4904,B96,30,Monday,1,['light'],"I was really disappointed with my experience. The bike had a light issue that made it unsafe to ride, and I couldn't get the help I needed. This situation left me feeling frustrated and dissatisfied. I hope improvements are made for future rentals."
R0436,U2113,B31,120,Tuesday,1,"['chain', 'light']","My experience with the bike rental was disappointing. The chain kept slipping, which made for a frustrating ride, and the lights weren't working, leaving me in the dark. I expected more reliability from the service."
R0437,U6104,B128,45,Thursday,2,"['light', 'saddle']","Unfortunately, my experience was quite disappointing. The bike had issues with the lights, which made me feel unsafe while riding, and the saddle was uncomfortable. I expected better quality and readiness from the service. I hope improvements are made for future riders."
R0438,U9347,B196,300,Thursday,3,['chain'],"The ride didn't go as smoothly as expected due to a chain issue, which was quite frustrating. Despite the beautiful scenery, the interruptions definitely impacted the overall experience. I hope the maintenance on the bikes improves for future rentals."
R0439,U1727,B96,30,Thursday,2,"['battery', 'chain']","I was quite disappointed with my experience this time. The battery issues made for an inconvenient ride, and the chain problems were frustrating as well. I expected much better quality and reliability from this service."
R0440,U4577,B286,90,Wednesday,3,['unavailable bike'],"The experience was somewhat frustrating due to the unavailable bike, which disrupted my plans. I expected a smoother process when renting. While the ride itself wasn’t bad, I hope improvements can be made for future rentals."
R0441,U9757,B234,45,Friday,2,['saddle'],The ride was quite uncomfortable due to the saddle issue. It really detracted from my overall experience. I expected better quality from a rental service. I hope these concerns are addressed for future riders.
R0442,U3708,B154,45,Sunday,2,"['chain', 'brakes']","I was really disappointed with my bike rental experience. The chain kept slipping, and the brakes were not functioning properly, which made for a stressful ride. I expected better maintenance and reliability. Unfortunately, I won't be renting from here again."
R0443,U2189,B280,120,Tuesday,4,['none'],"I had a great experience during my ride on Tuesday. The bike was in good condition and the duration was just right for my outing. Overall, a very enjoyable time! Would definitely recommend this service!"
R0444,U5396,B130,240,Friday,4,['brakes'],"The ride was enjoyable overall, but the brakes raised some concerns. It would be great to have better maintenance checks to ensure safety. Despite this issue, I appreciated the convenience and overall experience provided. Looking forward to my next ride!"
R0445,U5574,B42,120,Friday,4,['light'],"I had a great experience with the bike rental! The ride was enjoyable and the weather was perfect for a long trip. There was a slight issue with the bike lights, but it didn't impact my overall enjoyment. I'll definitely consider renting again!"
