ride_id,user_id,bike_id,ride_duration,ride_day,satisfaction,issue,comment
R0001,U1803,B242,45,Monday,5,['reservation problem'],"I had a great experience with the bike rental service! The ride was smooth and enjoyable despite a small reservation hiccup. Everything else was top-notch, and I’d definitely rent again!"
R0002,U7964,B221,45,Monday,2,"['saddle', 'reservation problem']","I was disappointed with my experience overall. The saddle was uncomfortable, making the ride less enjoyable, and there were issues with my reservation that added to my frustration. I expected better service and quality for my rental."
R0003,U6890,B167,30,Monday,3,['reservation problem'],"The reservation process was frustrating and seemed to cause some issues during my ride. While the bike was decent, the hiccup in booking took away from the overall experience. I hope the system can be improved for next time."
R0004,U4949,B266,60,Friday,5,['none'],"I had an amazing experience with the bike rental service! The bike was in excellent condition, and the ride was smooth and enjoyable. Everything went perfectly, making for a fantastic day out. Highly recommend it!"
R0005,U4896,B39,90,Monday,1,"['brakes', 'battery']","I'm really disappointed with my rental experience. The brakes were malfunctioning, and the battery died halfway through my ride, making it a safety concern. I expected much better quality and maintenance. I won't be renting from here again unless these issues are addressed."
R0006,U8726,B276,30,Saturday,5,['none'],"I had an amazing experience with the bike rental service! The bike was in excellent condition, and I enjoyed a smooth ride throughout. Everything went perfectly, making my Saturday outing truly enjoyable. I highly recommend this service to anyone looking to explore!"
R0007,U1773,B255,45,Friday,1,"['battery', 'brakes']","I had a disappointing experience with the bike rental. The battery was unreliable, and the brakes were not functioning properly, which made the ride stressful. I expected better quality and safety from the service. I won't be renting from here again."
R0008,U7275,B151,180,Saturday,2,"['unavailable bike', 'chain']",My experience was quite frustrating due to the bike being unavailable and issues with the chain. It really impacted my plans for the day. I expected much better from this rental service. I hope they can resolve these problems for future customers.
R0009,U2813,B220,30,Thursday,4,['saddle'],"The ride was enjoyable overall, but I did have some discomfort with the saddle. It affected my experience a bit, but the service was otherwise great. I'm looking forward to renting again, hopefully with a better saddle next time!"
R0010,U1847,B156,60,Sunday,4,['none'],I had a great ride on Sunday! The bike was in good condition and made for a smooth experience. I really enjoyed the outing and would definitely rent again.
R0011,U5737,B81,90,Monday,1,['reservation problem'],"I had a frustrating experience with my reservation being mixed up. It was really disappointing to deal with the inconvenience, especially after looking forward to my ride. I hope they can improve their booking system in the future."
R0012,U9779,B240,30,Wednesday,5,['none'],"I had a fantastic experience with the bike rental! The bike was in great condition, and the ride was smooth and enjoyable. Highly recommend for a fun day out!"
R0013,U7621,B74,30,Wednesday,2,['brakes'],"I had a disappointing experience with the bike rental. The brakes were not functioning properly, which made the ride unsafe and stressful. I expected better maintenance, as this impacted my overall enjoyment. I hope the service improves in the future."
R0014,U7849,B95,30,Sunday,2,"['reservation problem', 'saddle']","I was quite disappointed with my experience. The reservation issue caused a lot of confusion, and the saddle was uncomfortable throughout my ride. I expected a smoother and more enjoyable process. I hope these issues can be addressed for future riders."
R0015,U7456,B156,180,Thursday,3,['reservation problem'],"Had a decent experience overall, but the reservation problems really put a damper on the ride. It was frustrating to deal with those issues on what could have been a great day out. I hope the service improves in the future."
R0016,U8073,B251,30,Saturday,1,"['reservation problem', 'light']","I had a frustrating experience with my bike rental. There was a significant reservation issue that left me without a bike, and the light on the bike was not working properly. Overall, this experience did not meet my expectations at all."
R0017,U5618,B115,30,Tuesday,3,['light'],"The ride was decent but had a couple of issues that impacted the experience. The light malfunction was a concern, and it would be great if the bikes were better maintained. Overall, while it met my needs, improvements are definitely needed for a smoother experience."
R0018,U2152,B148,30,Sunday,3,"['saddle', 'chain']","The ride was decent, but I encountered some issues with the saddle and chain that affected my overall experience. It was frustrating to have those interruptions during my ride. I hope these problems can be addressed for future rentals."
R0019,U8556,B13,30,Thursday,5,['none'],"I had an amazing experience with the bike rental service! The bike was in excellent condition, and everything went smoothly during my 30-minute ride. I’ll definitely be coming back for more rides in the future!"
R0020,U5053,B35,60,Thursday,1,"['chain', 'light']","I was really disappointed with my recent bike rental. The chain kept slipping, and the light was malfunctioning, which made my ride quite frustrating. Unfortunately, these issues overshadowed the experience and made it unsafe. I hope improvements can be made for future customers."
R0021,U5502,B17,30,Sunday,5,['none'],"I had a fantastic experience renting a bike this Sunday! The ride was smooth and enjoyable, and everything was in perfect condition. Highly recommend this service for a great time outdoors!"
R0022,U4336,B22,60,Wednesday,2,"['unavailable bike', 'light']","My experience was disappointing due to the unavailability of the bike I had reserved, which caused unnecessary delays. Additionally, the light on the bike did not work, making it challenging to ride safely. Overall, this ride did not meet my expectations, and I hope for better reliability in the future."
R0023,U2642,B260,60,Wednesday,2,"['light', 'brakes']","I was disappointed with my rental experience. The brakes were not functioning properly, and the lights were inadequate, making the ride unsafe. I expected better maintenance and reliability from the service."
R0024,U9339,B252,120,Thursday,4,['brakes'],"I had a great time riding, but I did encounter some issues with the brakes which made me a bit uneasy. Overall, the experience was enjoyable and the bike was comfortable for the long ride. It would be helpful to ensure that the maintenance is checked regularly to avoid similar issues in the future. Looking forward to my next ride!"
R0025,U8033,B246,30,Monday,4,['brakes'],"The bike rental experience was generally good, aside from some concerns with the brakes. Despite this issue, I enjoyed my ride and appreciated the bike's overall condition. I'd recommend the service but hope for better maintenance in the future."
R0026,U6794,B17,120,Wednesday,5,['none'],I had an amazing experience renting a bike! Everything was smooth and the bike was in great condition. It made for a wonderful ride on a Wednesday. I can't wait to rent again!
R0027,U4621,B24,60,Tuesday,2,['saddle'],"I had a frustrating experience with my bike rental. The saddle was uncomfortable, which made my ride unpleasant. I expected better quality for the price I paid. This has really impacted my decision to rent again."
R0028,U8404,B84,30,Monday,2,"['battery', 'saddle']","I was disappointed with my recent bike rental experience. The battery did not hold a charge, making the ride frustrating, and the saddle was uncomfortable. I expected better quality and maintenance from the service. "
R0029,U5908,B170,90,Saturday,2,"['reservation problem', 'cargo']","I had a disappointing experience with my bike rental. The reservation problem caused unnecessary stress, and the cargo situation was frustrating. I expected a smoother adventure, but it fell short of my expectations. I hope improvements are made for future customers."
R0030,U4990,B100,120,Thursday,3,['cargo'],"The ride encountered some issues with the cargo, which impacted the overall experience. It would be great if the service could improve on handling such situations to enhance customer satisfaction. I hope future rides will go more smoothly."
R0031,U5053,B146,45,Wednesday,4,['brakes'],"I had a nice ride overall, but I did encounter some issues with the brakes, which dampened the experience a bit. The duration was perfect for a midweek escape, and the scenery was lovely. I appreciate the quality of the bikes but would suggest a thorough check on the brakes before the next use."
R0032,U3044,B52,180,Wednesday,1,"['light', 'chain']","I had a disappointing experience with the bike rental. The lights weren't working properly, and the chain kept slipping, which made my ride frustrating. I expected better maintenance for safety and enjoyment. Unfortunately, I won't be renting from here again."
R0033,U1829,B219,60,Wednesday,2,"['saddle', 'light']","I had a disappointing experience with my bike rental. The saddle was uncomfortable and the light wasn’t working properly, making my ride less enjoyable. I expected better quality and functionality from the equipment provided. Would not recommend unless improvements are made."
R0034,U5990,B94,60,Friday,2,['light'],"The ride experience left much to be desired. The bike had a persistent light issue that really impacted the overall enjoyment. It's disappointing when equipment doesn't function properly, especially during a Friday outing. I hope improvements are made for future rentals."
R0035,U8990,B20,300,Sunday,3,['reservation problem'],"The reservation process was quite frustrating and didn't go as planned. It took too long to sort out the issues, which impacted my overall experience. While I enjoyed the ride once everything was resolved, the initial problems made it less enjoyable than it could have been."
R0036,U1574,B223,45,Sunday,2,['brakes'],"I was really disappointed with my ride. The brakes were faulty, which made me feel unsafe throughout the trip. I expected better quality and reliability from the rental service, especially on a Sunday outing."
R0037,U8723,B270,120,Wednesday,2,"['battery', 'brakes']","Unfortunately, my ride didn't meet expectations. The battery died midway, and the brakes were unresponsive, making it a frustrating experience. I hope these issues are addressed for future rentals."
R0038,U8447,B5,45,Wednesday,4,['light'],"The ride was enjoyable, and the light issue was minor enough not to ruin the experience. I appreciate the smooth process and the overall quality of the bike. Looking forward to renting again!"
R0039,U3490,B131,90,Thursday,1,['chain'],"I'm really disappointed with my recent bike rental experience. The chain issue made the ride frustrating and difficult to enjoy. I expected better maintenance and reliability. Unfortunately, I won't be returning anytime soon."
R0040,U6684,B248,60,Thursday,2,['battery'],"I was really disappointed with my ride. The battery issues made it difficult to enjoy the experience fully. I expected better reliability from the service, and it definitely needs improvement."
R0041,U2486,B212,30,Thursday,2,"['reservation problem', 'light']","I encountered significant issues with my reservation, which made the start of my ride quite frustrating. Additionally, the bike lights were inadequate, impacting my overall experience. This was disappointing, and I expected better service. Overall, I wouldn't recommend renting from here again based on this experience."
R0042,U7822,B257,45,Friday,4,['chain'],"I enjoyed my ride overall, but I did encounter some issues with the bike's chain. It interrupted the flow of my trip a bit. Despite that, the experience was mostly positive, and I appreciated the easy rental process."
R0043,U7304,B125,45,Thursday,2,"['saddle', 'unavailable bike']","I was disappointed with my rental experience. The saddle was uncomfortable, and the bike I wanted was unavailable, which made my ride frustrating. I expected better options and quality from this service."
R0044,U4190,B112,30,Wednesday,4,['light'],"The ride was enjoyable and the bike performed well overall. However, the light issue was a minor inconvenience that could use some attention. Looking forward to an even better experience next time!"
R0045,U1611,B213,30,Wednesday,2,"['reservation problem', 'brakes']","I'm really disappointed with my recent experience. There was a significant issue with the reservation process, and the brakes on the bike were not functioning properly, which made for a stressful ride. I expected more reliability from the service."
R0046,U9735,B46,45,Wednesday,3,"['light', 'brakes']","The ride was quite frustrating due to problems with the lights and brakes. Safety should always be a top priority, and unfortunately, these issues really affected my experience. I hope improvements can be made for future rentals."
R0047,U5010,B72,30,Monday,4,['light'],"The bike rental experience was mostly enjoyable, but I did notice the light was a bit dim. It affected my ride, especially in low visibility areas. Overall, the bike was comfortable and the service was efficient. Looking forward to a more seamless ride next time!"
R0048,U9037,B180,30,Tuesday,2,"['unavailable bike', 'brakes']","I was really disappointed with my experience. The bike I wanted was unavailable, and the brakes were not working properly. This made for a stressful ride that didn’t go as planned. I hope quality control improves in the future."
R0049,U7100,B200,90,Friday,5,['none'],"The bike rental experience was outstanding! The bike was in excellent condition, and my ride was smooth and enjoyable. I had no issues at all, making for a perfect Friday outing. Highly recommended!"
R0050,U8004,B36,90,Wednesday,1,['brakes'],"I had a frustrating experience with the bike rental. The brakes were not functioning properly, which made for a very unsafe ride. I expected better maintenance on the equipment. I won't be renting again unless improvements are made."
R0051,U7838,B152,90,Tuesday,5,['brakes'],"I had a fantastic experience with the bike rental! The ride was smooth, and I encountered no issues with the brakes at all. It exceeded my expectations for a Tuesday outing. I highly recommend this service!"
R0052,U2751,B110,45,Thursday,2,"['light', 'reservation problem']","I encountered multiple issues during my ride, including problems with the lighting and my reservation. This caused significant frustration and impacted my overall experience. I expected better service and hope improvements are made in the future."
R0053,U4274,B151,120,Friday,3,['saddle'],"The ride was decent, but the saddle issues really affected my experience. It became uncomfortable over time, which was disappointing. I hope improvements can be made for future rentals."
R0054,U5200,B287,60,Tuesday,3,['saddle'],"The ride had potential, but the saddle discomfort really affected my experience. I expected a smoother ride, especially since it lasted an hour. I hope improvements are made for future rentals."
R0055,U5479,B23,30,Saturday,4,['light'],"The ride was enjoyable and the bike performed well overall. There was a minor issue with the light, but it didn't significantly affect my experience. I appreciate the service and would consider renting again in the future."
R0056,U1394,B298,30,Sunday,2,['brakes'],I was really disappointed with my bike rental experience. The brakes were faulty and made the ride feel unsafe. I expected better maintenance and reliability from the service. I won't be renting again unless improvements are made.
R0057,U5918,B135,90,Thursday,2,['battery'],"I encountered significant issues with the bike battery during my ride, which really affected my experience. It was disappointing to have to deal with such a fundamental problem. I expected a smoother ride, especially since I had planned for a longer duration. I hope improvements are made for future rentals."
R0058,U2388,B231,30,Friday,1,['unavailable bike'],"I was really disappointed with my bike rental experience. The bike I wanted was unavailable, which wasted my time and left me feeling frustrated. I expected better service, especially on a busy Friday. This definitely needs improvement."
R0059,U7689,B127,60,Monday,2,"['light', 'battery']","I was really disappointed with my recent bike rental. The light wasn't working properly, and I also had battery issues, which made the ride frustrating. I expected a much better experience, and this fell short."
R0060,U7146,B93,300,Sunday,1,"['battery', 'reservation problem']","I had a very frustrating experience with my bike rental. The battery didn't last long enough for my ride, and there were issues with my reservation that caused delays. I expected better service and reliability, and this experience was disappointing. I hope improvements can be made for future customers."
R0061,U9301,B231,30,Wednesday,3,"['battery', 'light']","The ride had a couple of notable issues with the battery and the light, which affected the overall experience. It was frustrating to deal with these problems during my ride. I hope improvements can be made to enhance reliability in the future."
R0062,U7702,B206,30,Sunday,3,['battery'],"The ride started off well, but I encountered a battery issue that disrupted my experience. It was frustrating and took away from the enjoyment of the ride. I hope improvements can be made to ensure a smoother experience in the future."
R0063,U4299,B44,300,Thursday,2,"['light', 'chain']","I was really disappointed with my recent rental experience. The bike had issues with the lights and chain, which made my ride frustrating and unsafe. I expected better maintenance and reliability from the service. Unfortunately, this experience did not meet my expectations."
R0064,U9706,B211,60,Monday,4,['reservation problem'],"Overall, the ride was enjoyable and the bike was in great condition. However, there was a frustrating reservation issue that caused some inconvenience. Despite this hiccup, I still had a good experience and would consider renting again."
R0065,U4697,B226,30,Monday,2,"['chain', 'unavailable bike']","I was quite disappointed with my experience. The bike had issues with the chain, and there was no other bike available when I needed one. This made my ride frustrating and not enjoyable at all. I'll have to think twice before renting again."
R0066,U3932,B116,120,Friday,2,['light'],"I was quite disappointed with my recent bike rental experience. Although the ride was supposed to be enjoyable, I encountered issues with the bike’s light, which made it feel unsafe. I expected better quality and maintenance from the service. I hope improvements are made in the future."
R0067,U9148,B277,120,Thursday,3,"['chain', 'brakes']","The ride had potential, but unfortunately, I faced some issues with the chain and brakes which affected the overall experience. This made it difficult to enjoy the ride fully. I hope these concerns can be addressed for future rentals."
R0068,U4333,B192,60,Monday,3,['brakes'],"The ride was generally enjoyable, but I faced issues with the brakes, which affected my experience. I hope the bike's maintenance is improved for future rentals. Overall, it was decent, but there's room for enhancement."
R0069,U1687,B100,60,Friday,2,['brakes'],"I was really disappointed with my recent bike rental experience. The brakes were not functioning properly, which made the ride quite stressful and unsafe. I expected better maintenance for the bikes, especially given the trust I put in the service. I hope improvements are made to ensure safer rides in the future."
R0070,U5225,B4,45,Saturday,3,['brakes'],"I encountered some issues with the brakes during my ride, which affected my overall experience. While the bike was decent, the brake problem was concerning and detracted from the enjoyment. I hope these maintenance issues are addressed for future customers."
R0071,U8160,B202,30,Thursday,2,['reservation problem'],I encountered a frustrating reservation problem that really affected my experience with the bike rental service. It was disappointing to face issues that shouldn't have happened in the first place. I hope they can improve their booking process for future riders.
R0072,U2705,B63,60,Thursday,2,"['saddle', 'brakes']","I was really disappointed with my recent bike rental. The saddle was uncomfortable and the brakes weren't functioning properly, making the ride quite stressful. I expected better quality and maintenance for the price I paid. I hope improvements are made for future renters."
R0073,U5166,B227,45,Monday,4,['reservation problem'],"The ride was enjoyable overall, but I did experience some issues with the reservation process that could use improvement. Despite this, the bike was in great condition and the ride was smooth. I hope future rentals will have a more streamlined booking experience."
R0074,U2169,B158,90,Friday,3,"['light', 'chain']",My ride was quite frustrating due to issues with the bike's light and chain. It made the experience less enjoyable than I had hoped. Some improvements could definitely enhance the service. I hope future rentals will be in better condition.
R0075,U7177,B140,120,Wednesday,2,"['chain', 'reservation problem']","I was quite disappointed with my experience. The bike's chain was problematic and the reservation issue added unnecessary stress. Overall, the ride did not meet my expectations, and I left feeling frustrated."
R0076,U5280,B49,30,Saturday,5,['unavailable bike'],"The bike rental experience was great, but I did face the inconvenience of an unavailable bike. Despite that, the customer service was responsive and helpful. I look forward to my next ride!"
R0077,U3971,B213,60,Wednesday,5,['none'],"Had a fantastic time riding! The bike was in excellent condition, and everything went smoothly during the entire hour. Can't wait to rent again for another great experience!"
R0078,U3041,B50,30,Thursday,5,['light'],"I had an amazing experience with the bike rental service! The ride was smooth, and I really appreciated the well-maintained bikes. I couldn't have asked for a better way to spend my Thursday. Highly recommend to anyone looking for a fun ride!"
R0079,U6079,B125,120,Tuesday,2,"['reservation problem', 'light']","I had a disappointing experience with my bike rental. The reservation process was confusing, and the bike's light was not working properly, which made riding unsafe. I expected better service and functionality."
R0080,U7027,B251,45,Tuesday,3,['saddle'],"The ride was fairly okay, but I encountered issues with the saddle that made it uncomfortable. I hoped for a better experience overall. Improvements in bike maintenance would really enhance the rental service."
R0081,U9461,B276,60,Friday,5,['unavailable bike'],"I had a fantastic experience with the bike rental service! The bike was in perfect condition, making my 60-minute ride enjoyable. I'll definitely be renting again soon!"
R0082,U4933,B296,60,Thursday,2,"['light', 'reservation problem']","I was really disappointed with my recent experience. There were issues with the bike lights, and my reservation wasn't handled correctly, making things frustrating. Overall, it did not meet my expectations at all. I hope these problems can be addressed for future riders."
R0083,U2446,B287,45,Thursday,1,"['battery', 'chain']","I had a frustrating experience with my bike rental. The battery didn’t hold a charge and the chain kept slipping, making the ride very difficult. I expected a smoother experience, but unfortunately, this was quite disappointing. I hope these issues are addressed for future rentals."
R0084,U8493,B167,90,Sunday,1,"['saddle', 'reservation problem']","I'm really disappointed with my bike rental experience. The saddle was uncomfortable and there were issues with my reservation, which only added to my frustration. This experience did not meet my expectations at all. I hope improvements can be made for future customers."
R0085,U6667,B60,90,Sunday,3,['chain'],"The ride had potential, but the chain issue really impacted our experience. It was frustrating to deal with that during our time out. I hope future rentals pay more attention to bike maintenance to avoid these problems."
R0086,U7301,B251,60,Saturday,2,['light'],"I was quite disappointed with my recent bike rental experience. The bike had issues with the lights, which made the ride less enjoyable and safe. Unfortunately, this overshadowed the whole experience for me. I hope improvements will be made for future rentals."
R0087,U1874,B240,90,Tuesday,4,['brakes'],"I had a great experience overall, but I did encounter some issues with the brakes during my ride. It wasn't a major problem, but it did affect my confidence a bit. The bike was otherwise enjoyable, and I appreciated the quality of service. I'm looking forward to renting again!"
R0088,U3810,B297,300,Thursday,5,['unavailable bike'],"I had a fantastic bike rental experience! The ride was smooth and enjoyable, and the bike was in excellent condition. I look forward to my next adventure, as everything turned out great despite the initial bike availability issue!"
R0089,U7909,B195,45,Saturday,3,['brakes'],"My experience was okay, but the brakes had some issues that made me uneasy during the ride. It detracted from what could have been an enjoyable experience. I hope the maintenance team can address this for future renters."
